### ISSUE TITLE
[BUG] DNS issues with demo cluster in WSL 

### ISSUE THREAD

**Issue by Thyholt** [flyteorg/flyte#5853]
### Describe the bug

I'm attempting to run a demo cluster locally in WSL running `flytectl demo start`. The cluster runs as expected. However, there are excessive failing external DNS queries towards internal cluster resources, causing DNS issues for WSL, which effectively blocks internet access in WSL, making the demo cluster useless. When removing forwarding to /etc/resolv.conf in the core-dns configmap before the cluster is ready, the issue no longer causes DNS issues, simply because external queries can't be made. But of course, this isn't a fix, since workflows needs to be able to make external calls. When I use the google nameserver 8.8.8.8, the issue is still there, but it doesn't block internet access, and it's not a acceptable fix. After tearing down the cluster, the excessive DNS queries continues for a while, before ending. I tried both Ubuntu 20 and 22, and with the same issue.

Note that I'm not experienced with DNS, and that the description is based on what I can see in the available logs.

Below are samples from logs and configurations. Note that the problem is related to only minio, http, grpc and kubernetes. 

```
sudo tcpdump -i docker0
tcpdump: verbose output suppressed, use -v[v]... for full protocol decode
listening on docker0, link-type EN10MB (Ethernet), snapshot length 262144 bytes

14:59:13.650686 IP 172.17.0.2.37268 > 172.24.176.1.domain: 26203+ NS? . (17)
14:59:15.152769 IP 172.17.0.2.17744 > 172.24.176.1.domain: 20723+ NS? . (17)
14:59:15.164631 IP 172.17.0.2.40296 > 172.24.176.1.domain: 18633+ AAAA? flyte-sandbox-http. (36)
14:59:15.509986 IP 172.17.0.2.14767 > 172.24.176.1.domain: 20535+ AAAA? flyte-sandbox-kubernetes-dashboard. (52)
14:59:16.654138 IP 172.17.0.2.34271 > 172.24.176.1.domain: 58138+ NS? . (17)
14:59:21.515615 IP 172.17.0.2.11656 > 172.24.176.1.domain: 11196+ AAAA? flyte-sandbox-kubernetes-dashboard. (52)
14:59:22.382047 IP 172.17.0.2.26954 > 172.24.176.1.domain: 24103+ AAAA? flyte-sandbox-minio. (37)
14:59:22.504035 IP 172.17.0.2.5018 > 172.24.176.1.domain: 61914+ AAAA? flyte-sandbox-grpc. (36)
14:59:22.658391 IP 172.17.0.2.33774 > 172.24.176.1.domain: 62089+ NS? . (17)
14:59:24.160977 IP 172.17.0.2.4490 > 172.24.176.1.domain: 33570+ NS? . (17)
14:59:24.384316 IP 172.17.0.2.11675 > 172.24.176.1.domain: 63374+ AAAA? flyte-sandbox-minio. (37)
14:59:24.506721 IP 172.17.0.2.1978 > 172.24.176.1.domain: 39214+ AAAA? flyte-sandbox-grpc. (36)
14:59:25.662785 IP 172.17.0.2.35555 > 172.24.176.1.domain: 10480+ NS? . (17)
14:59:27.164208 IP 172.17.0.2.49898 > 172.24.176.1.domain: 17484+ NS? . (17)
14:59:28.181951 IP 172.17.0.2.57436 > 172.24.176.1.domain: 977+ AAAA? flyte-sandbox-http. (36)
14:59:28.518283 IP 172.17.0.2.49120 > 172.24.176.1.domain: 59819+ AAAA? flyte-sandbox-kubernetes-dashboard. (52)
14:59:28.666043 IP 172.17.0.2.3593 > 172.24.176.1.domain: 34746+ NS? . (17)
14:59:30.166685 IP 172.17.0.2.42247 > 172.24.176.1.domain: 19298+ NS? . (17)
14:59:30.185461 IP 172.17.0.2.14746 > 172.24.176.1.domain: 26974+ AAAA? flyte-sandbox-http. (36)
14:59:30.520261 IP 172.17.0.2.10114 > 172.24.176.1.domain: 44777+ AAAA? flyte-sandbox-kubernetes-dashboard. (52)
14:59:31.389420 IP 172.17.0.2.40542 > 172.24.176.1.domain: 27352+ AAAA? flyte-sandbox-minio. (37)
14:59:31.502082 IP 172.17.0.2.32144 > 172.24.176.1.domain: 21926+ AAAA? flyte-sandbox-grpc. (36)
14:59:31.668203 IP 172.17.0.2.53492 > 172.24.176.1.domain: 28903+ NS? . (17)
14:59:32.186786 IP 172.17.0.2.47322 > 172.24.176.1.domain: 23887+ AAAA? flyte-sandbox-http. (36)
14:59:32.521695 IP 172.17.0.2.rtcm-sc104 > 172.24.176.1.domain: 61764+ AAAA? flyte-sandbox-kubernetes-dashboard. (52)
14:59:33.170097 IP 172.17.0.2.30271 > 172.24.176.1.domain: 39993+ NS? . (17)
14:59:33.391749 IP 172.17.0.2.43897 > 172.24.176.1.domain: 5835+ AAAA? flyte-sandbox-minio. (37)
14:59:33.504539 IP 172.17.0.2.51920 > 172.24.176.1.domain: 46801+ AAAA? flyte-sandbox-grpc. (36)
14:59:34.188243 IP 172.17.0.2.48654 > 172.24.176.1.domain: 56277+ AAAA? flyte-sandbox-http. (36)
14:59:34.524286 IP 172.17.0.2.12524 > 172.24.176.1.domain: 60917+ AAAA? flyte-sandbox-kubernetes-dashboard. (52)
14:59:34.672031 IP 172.17.0.2.23419 > 172.24.176.1.domain: 40446+ NS? . (17)
14:59:35.393095 IP 172.17.0.2.57229 > 172.24.176.1.domain: 50279+ AAAA? flyte-sandbox-minio. (37)
14:59:35.507022 IP 172.17.0.2.8463 > 172.24.176.1.domain: 52639+ AAAA? flyte-sandbox-grpc. (36)
14:59:36.173839 IP 172.17.0.2.64329 > 172.24.176.1.domain: 62898+ NS? . (17)
14:59:37.395138 IP 172.17.0.2.44447 > 172.24.176.1.domain: 44827+ AAAA? flyte-sandbox-minio. (37)
14:59:37.509460 IP 172.17.0.2.53551 > 172.24.176.1.domain: 45436+ AAAA? flyte-sandbox-grpc. (36)
14:59:37.676712 IP 172.17.0.2.12999 > 172.24.176.1.domain: 5454+ NS? . (17)
14:59:39.178751 IP 172.17.0.2.62330 > 172.24.176.1.domain: 21348+ NS? . (17)
14:59:40.679862 IP 172.17.0.2.56041 > 172.24.176.1.domain: 13816+ NS? . (17)
14:59:41.194599 IP 172.17.0.2.1436 > 172.24.176.1.domain: 5843+ AAAA? flyte-sandbox-http. (36)
14:59:41.523461 IP 172.17.0.2.56203 > 172.24.176.1.domain: 36527+ AAAA? flyte-sandbox-kubernetes-dashboard. (52)
14:59:42.182287 IP 172.17.0.2.51057 > 172.24.176.1.domain: 37657+ NS? . (17)
14:59:43.196859 IP 172.17.0.2.1991 > 172.24.176.1.domain: 9644+ AAAA? flyte-sandbox-http. (36)
14:59:43.525976 IP 172.17.0.2.29600 > 172.24.176.1.domain: 42521+ AAAA? flyte-sandbox-kubernetes-dashboard. (52)
14:59:43.684918 IP 172.17.0.2.30957 > 172.24.176.1.domain: 52268+ NS? . (17)
14:59:44.391868 IP 172.17.0.2.1440 > 172.24.176.1.domain: 4706+ AAAA? flyte-sandbox-minio. (37)
14:59:44.513758 IP 172.17.0.2.40781 > 172.24.176.1.domain: 42410+ AAAA? flyte-sandbox-grpc. (36)
14:59:45.187046 IP 172.17.0.2.12980 > 172.24.176.1.domain: 35932+ NS? . (17)
...
```

Note that 172.24.176.1 is the WSL nameserver.

```
kubectl logs coredns-6799fbcd5-7r4h5 -n kube-system

[INFO] 10.42.0.9:56565 - 46047 "AAAA IN flyteagent.flyte.svc.cluster.local.svc.cluster.local. udp 70 false 512" NXDOMAIN qr,aa,rd 163 0.000092732s
[INFO] 10.42.0.9:56565 - 14812 "A IN flyteagent.flyte.svc.cluster.local.svc.cluster.local. udp 70 false 512" NXDOMAIN qr,aa,rd 163 0.000122486s
[INFO] 10.42.0.9:45474 - 7081 "AAAA IN flyteagent.flyte.svc.cluster.local.cluster.local. udp 66 false 512" NXDOMAIN qr,aa,rd 159 0.000141125s
[INFO] 10.42.0.9:45474 - 57003 "A IN flyteagent.flyte.svc.cluster.local.cluster.local. udp 66 false 512" NXDOMAIN qr,aa,rd 159 0.000212829s
[INFO] 10.42.0.9:55627 - 51842 "AAAA IN flyteagent.flyte.svc.cluster.local. udp 52 false 512" NOERROR qr,aa,rd 145 0.00009358s
[INFO] 10.42.0.9:55627 - 21127 "A IN flyteagent.flyte.svc.cluster.local. udp 52 false 512" NOERROR qr,aa,rd 102 0.000116846s
[INFO] 10.42.0.9:52484 - 2581 "TXT IN _grpc_config.flyteagent.flyte.svc.cluster.local. udp 76 false 1232" NXDOMAIN qr,aa,rd 158 0.000253807s
[INFO] 10.42.0.9:50078 - 7909 "TXT IN _grpc_config.flyteagent.flyte.svc.cluster.local.flyte.svc.cluster.local. udp 100 false 1232" NXDOMAIN qr,aa,rd 182 0.00010924s
[INFO] 10.42.0.9:34912 - 7700 "TXT IN _grpc_config.flyteagent.flyte.svc.cluster.local.svc.cluster.local. udp 94 false 1232" NXDOMAIN qr,aa,rd 176 0.000445882s
[INFO] 10.42.0.9:34577 - 23822 "TXT IN _grpc_config.flyteagent.flyte.svc.cluster.local.cluster.local. udp 90 false 1232" NXDOMAIN qr,aa,rd 172 0.000128495s
[INFO] 127.0.0.1:50936 - 10723 "HINFO IN 5727650115051265721.699382213259293701. udp 56 false 512" - - 0 2.000370063s
[ERROR] plugin/errors: 2 5727650115051265721.699382213259293701. HINFO: read udp 10.42.0.8:43876->172.24.176.1:53: i/o timeout
[INFO] 10.42.0.4:36190 - 62848 "AAAA IN flyte-sandbox-http. udp 36 false 512" - - 0 2.001118311s
[ERROR] plugin/errors: 2 flyte-sandbox-http. AAAA: read udp 10.42.0.8:57534->172.24.176.1:53: i/o timeout
[INFO] 10.42.0.4:36190 - 27194 "AAAA IN flyte-sandbox-kubernetes-dashboard. udp 52 false 512" - - 0 2.000802382s
[ERROR] plugin/errors: 2 flyte-sandbox-kubernetes-dashboard. AAAA: read udp 10.42.0.8:34531->172.24.176.1:53: i/o timeout
[INFO] 10.42.0.4:36190 - 26578 "AAAA IN flyte-sandbox-grpc.flyte.svc.cluster.local. udp 60 false 512" NOERROR qr,aa,rd 153 0.000586708s
[INFO] 10.42.0.4:36190 - 38429 "AAAA IN flyte-sandbox-grpc.svc.cluster.local. udp 54 false 512" NXDOMAIN qr,aa,rd 147 0.000428682s
[INFO] 10.42.0.4:36190 - 19274 "AAAA IN flyte-sandbox-grpc.cluster.local. udp 50 false 512" NXDOMAIN qr,aa,rd 143 0.000268292s
[INFO] 10.42.0.4:36190 - 62848 "AAAA IN flyte-sandbox-http. udp 36 false 512" - - 0 2.001317543s
[ERROR] plugin/errors: 2 flyte-sandbox-http. AAAA: read udp 10.42.0.8:42536->172.24.176.1:53: i/o timeout
...
```

Coredns configmap:

```
apiVersion: v1
data:
  Corefile: |
    .:53 {
        log
        errors
        health
        ready
        kubernetes cluster.local in-addr.arpa ip6.arpa {
          pods insecure
          fallthrough in-addr.arpa ip6.arpa
        }
        hosts /etc/coredns/NodeHosts {
          ttl 60
          reload 15s
          fallthrough
        }
        prometheus :9153
        forward . /etc/resolv.conf
        cache 30
        loop
        reload
        loadbalance
        import /etc/coredns/custom/*.override
    }
    import /etc/coredns/custom/*.server
  NodeHosts: |
    172.17.0.2 23b6d4f14c1a
kind: ConfigMap
metadata:
  annotations:
    objectset.rio.cattle.io/applied: H4sIAAAAAAAA/4yQwWrz...
    objectset.rio.cattle.io/id: ""
    objectset.rio.cattle.io/owner-gvk: k3s.cattle.io/v1, Kind=Addon
    objectset.rio.cattle.io/owner-name: coredns
    objectset.rio.cattle.io/owner-namespace: kube-system
  creationTimestamp: "2024-10-17T09:44:04Z"
  labels:
    objectset.rio.cattle.io/hash: bce283298811743a0386ab510f2f67ef74240c57
  name: coredns
  namespace: kube-system
  resourceVersion: "4203"
  uid: fcdc5add-f0f0-4257-984e-4a065c3548d3
```

Pods:

```
kubectl get pods -A
NAMESPACE     NAME                                                  READY   STATUS    RESTARTS   AGE
flyte         flyte-sandbox-kubernetes-dashboard-5b4465fcfb-k5k7q   1/1     Running   0          3h5m
kube-system   local-path-provisioner-84db5d44d9-7d779               1/1     Running   0          3h5m
kube-system   coredns-6799fbcd5-7r4h5                               1/1     Running   0          3h5m
flyte         flyte-sandbox-docker-registry-6f9945c96d-zb9wg        1/1     Running   0          3h5m
flyte         flyte-sandbox-buildkit-55b956cfbb-fzf8r               1/1     Running   0          3h5m
kube-system   metrics-server-67c658944b-fqfd2                       1/1     Running   0          3h5m
flyte         flyte-sandbox-minio-797448f46d-62ftm                  1/1     Running   0          3h5m
flyte         flyte-sandbox-postgresql-0                            1/1     Running   0          3h5m
flyte         flyteagent-5c75cc45b7-xdc6k                           1/1     Running   0          3h5m
flyte         flyte-sandbox-proxy-74bcd9c78f-2mlmj                  1/1     Running   0          3h5m
flyte         flyte-sandbox-bd8bf6bdd-sh7pc                         1/1     Running   0          3h5m
```

Endpoints:

```
kubectl get endpoints -A
NAMESPACE     NAME                                 ENDPOINTS                                  AGE
default       kubernetes                           172.17.0.2:6443                            3h6m
flyte         flyte-sandbox-kubernetes-dashboard   10.42.0.5:9090                             3h6m
kube-system   kube-dns                             10.42.0.8:53,10.42.0.8:53,10.42.0.8:9153   3h6m
flyte         flyte-sandbox-docker-registry        10.42.0.6:5000                             3h6m
flyte         flyte-sandbox-postgresql-hl          10.42.0.11:5432                            3h6m
kube-system   metrics-server                       10.42.0.3:10250                            3h6m
flyte         flyte-sandbox-minio                  10.42.0.10:9000,10.42.0.10:9001            3h6m
flyte         flyte-sandbox-postgresql             10.42.0.11:5432                            3h6m
flyte         flyteagent                           10.42.0.7:8000                             3h6m
flyte         flyte-sandbox-proxy                  10.42.0.4:8000                             3h6m
flyte         flyte-sandbox-grpc                   10.42.0.9:8089                             3h6m
flyte         flyte-sandbox-webhook                10.42.0.9:9443                             3h6m
flyte         flyte-sandbox-http                   10.42.0.9:8088                             3h6m
```

Services:

```
kubectl get svc -A
NAMESPACE     NAME                                 TYPE        CLUSTER-IP      EXTERNAL-IP   PORT(S)                         AGE
default       kubernetes                           ClusterIP   10.43.0.1       <none>        443/TCP                         3h11m
kube-system   kube-dns                             ClusterIP   10.43.0.10      <none>        53/UDP,53/TCP,9153/TCP          3h11m
flyte         flyte-sandbox-docker-registry        NodePort    10.43.161.162   <none>        5000:30000/TCP                  3h11m
flyte         flyte-sandbox-grpc                   ClusterIP   10.43.189.174   <none>        8089/TCP                        3h11m
flyte         flyte-sandbox-http                   ClusterIP   10.43.6.85      <none>        8088/TCP                        3h11m
flyte         flyte-sandbox-kubernetes-dashboard   ClusterIP   10.43.52.102    <none>        80/TCP                          3h11m
flyte         flyte-sandbox-minio                  NodePort    10.43.148.170   <none>        9000:30002/TCP,9001:31700/TCP   3h11m
flyte         flyte-sandbox-postgresql             NodePort    10.43.104.29    <none>        5432:30001/TCP                  3h11m
flyte         flyte-sandbox-postgresql-hl          ClusterIP   None            <none>        5432/TCP                        3h11m
flyte         flyte-sandbox-proxy                  NodePort    10.43.181.107   <none>        8000:30080/TCP                  3h11m
flyte         flyte-sandbox-webhook                ClusterIP   10.43.194.224   <none>        443/TCP                         3h11m
flyte         flyteagent                           ClusterIP   10.43.205.7     <none>        8000/TCP                        3h11m
kube-system   metrics-server                       ClusterIP   10.43.195.78    <none>        443/TCP                         3h11m
```

WSL nameserver:

```
cat /etc/resolv.conf
# This file was automatically generated by WSL. To stop automatic generation of this file, add the following entry to /etc/wsl.conf:
# [network]
# generateResolvConf = false
nameserver 172.24.176.1
```

After changing nameserver to 8.8.8.8, what looks to be internal queries are clearly externally forwarded.

```
cat /etc/docker/daemon.json
{
  "dns": ["8.8.8.8", "8.8.4.4"]
}

user@computer:~$ sudo tcpdump -i docker0
tcpdump: verbose output suppressed, use -v[v]... for full protocol decode
listening on docker0, link-type EN10MB (Ethernet), snapshot length 262144 bytes
08:42:31.675556 IP 172.17.0.2.45574 > dns.google.domain: 53696+ AAAA? flyte-sandbox-http. (36)
08:42:31.675557 IP 172.17.0.2.31718 > dns.google.domain: 44150+ AAAA? flyte-sandbox-grpc. (36)
08:42:31.675571 IP 172.17.0.2.18406 > dns.google.domain: 10455+ AAAA? flyte-sandbox-minio. (37)
08:42:31.697101 IP dns.google.domain > 172.17.0.2.18406: 10455 NXDomain 0/1/0 (112)
08:42:31.697102 IP dns.google.domain > 172.17.0.2.45574: 53696 NXDomain 0/1/0 (111)
08:42:31.698453 IP dns.google.domain > 172.17.0.2.31718: 44150 NXDomain 0/1/0 (111)
08:42:31.730166 IP 172.17.0.2.45574 > dns.google.domain: 11705+ AAAA? flyte-sandbox-kubernetes-dashboard. (52)
08:42:31.751177 IP dns.google.domain > 172.17.0.2.45574: 11705 NXDomain 0/1/0 (127)
08:43:01.727188 IP 172.17.0.2.48683 > dns.google.domain: 34815+ AAAA? flyte-sandbox-http. (36)
08:43:01.727286 IP 172.17.0.2.28017 > dns.google.domain: 2708+ AAAA? flyte-sandbox-minio. (37)
08:43:01.727604 IP 172.17.0.2.37671 > dns.google.domain: 24370+ AAAA? flyte-sandbox-grpc. (36)
08:43:01.748750 IP dns.google.domain > 172.17.0.2.28017: 2708 NXDomain 0/1/0 (112)
08:43:01.749758 IP dns.google.domain > 172.17.0.2.48683: 34815 NXDomain 0/1/0 (111)
08:43:01.749799 IP dns.google.domain > 172.17.0.2.37671: 24370 NXDomain 0/1/0 (111)
08:43:01.764734 IP 172.17.0.2.20762 > dns.google.domain: 42321+ AAAA? flyte-sandbox-kubernetes-dashboard. (52)
08:43:01.787790 IP dns.google.domain > 172.17.0.2.20762: 42321 NXDomain 0/1/0 (127)
08:43:06.732653 ARP, Request who-has 172.17.0.1 tell 172.17.0.2, length 28
08:43:06.732663 ARP, Reply 172.17.0.1 is-at 02:42:27:37:bd:95 (oui Unknown), length 28
08:43:06.812622 ARP, Request who-has 172.17.0.2 tell 172.17.0.1, length 28
08:43:06.812660 ARP, Reply 172.17.0.2 is-at 02:42:ac:11:00:02 (oui Unknown), length 28
08:43:31.763764 IP 172.17.0.2.16325 > dns.google.domain: 14352+ AAAA? flyte-sandbox-http. (36)
08:43:31.764032 IP 172.17.0.2.48687 > dns.google.domain: 43212+ AAAA? flyte-sandbox-minio. (37)
08:43:31.764413 IP 172.17.0.2.31820 > dns.google.domain: 15149+ AAAA? flyte-sandbox-grpc. (36)
```

### Expected behavior

Demo cluster works as expected, without making external DNS queries and not causing DNS issues that blocks internet access.

### Additional context to reproduce

1. WSL, with docker engine instead of docker desktop.
2. Ubuntu 22 LTS distro.
3. Kubectl, flytectl and docker.
4. `flytectl demo start`
5. Use tcpdump or view core-dns logs to view failing external dns queries for cluster services.

### Screenshots

![image](https://github.com/user-attachments/assets/393f126e-bb16-41f7-adcf-941bcc54c802)

![image](https://github.com/user-attachments/assets/baf58584-d4b5-4718-bdfb-5c3c0ebb3176)

### Are you sure this issue hasn't been raised already?

- [X] Yes

### Have you read the Code of Conduct?

- [X] Yes
